name	dataaddr	tableaddr	sizey	sizex	type	category
Exhaust Cam Retard Angle Base AVCS	126da4	c2d64	24	12	3D	Variable Valve Timing (AVCS)
Intake Duty Correction A	1281bc	c2fb0	10	9	3D	Variable Valve Timing (AVCS)
Intake Duty Correction B	1282bc	c2fcc	10	9	3D	Variable Valve Timing (AVCS)
Intake Duty Correction C	1283bc	c2fe8	10	9	3D	Variable Valve Timing (AVCS)
Intake Duty Correction D	1284bc	c3004	10	9	3D	Variable Valve Timing (AVCS)
Intake Duty Correction E	128580	c3020	2	2	3D	Variable Valve Timing (AVCS)
Intake Duty Correction F	128598	c303c	2	2	3D	Variable Valve Timing (AVCS)
Intake Duty Correction AC Adjust A	126164	c2a48	16		2D	Variable Valve Timing (AVCS)
Intake Duty Correction AC Adjust B	126114	c2a34	16		2D	Variable Valve Timing (AVCS)
Intake Duty Correction BD Adjust A	126204	c2a70	16		2D	Variable Valve Timing (AVCS)
Intake Duty Correction BD Adjust B	1261b4	c2a5c	16		2D	Variable Valve Timing (AVCS)
Intake Duty Correction EF Adjust	126254	c2a84	16		2D	Variable Valve Timing (AVCS)
Intake Duty Correction E Adjust	12626c	c2a98	2		2D	Variable Valve Timing (AVCS)
Intake Duty Correction F Adjust	126278	c2aac	2		2D	Variable Valve Timing (AVCS)
Exhaust Duty Correction A	1286a4	c30ac	11	9	3D	Variable Valve Timing (AVCS)
Exhaust Duty Correction B	1287bc	c30c8	11	9	3D	Variable Valve Timing (AVCS)
Exhaust Duty Correction C	1288d4	c30e4	11	9	3D	Variable Valve Timing (AVCS)
Exhaust Duty Correction D	1289ec	c3100	11	9	3D	Variable Valve Timing (AVCS)
Exhaust Duty Correction E	128634	c3074	2	2	3D	Variable Valve Timing (AVCS)
Exhaust Duty Correction F	12864c	c3090	2	2	3D	Variable Valve Timing (AVCS)
Exhaust Duty Correction AC Adjust A	12630c	c2ad4	16		2D	Variable Valve Timing (AVCS)
Exhaust Duty Correction AC Adjust B	1262bc	c2ac0	16		2D	Variable Valve Timing (AVCS)
Exhaust Duty Correction BD Adjust A	1263ac	c2afc	16		2D	Variable Valve Timing (AVCS)
Exhaust Duty Correction BD Adjust B	12635c	c2ae8	16		2D	Variable Valve Timing (AVCS)
Exhaust Duty Correction EF Adjust	1263fc	c2b10	16		2D	Variable Valve Timing (AVCS)
Exhaust Duty Correction E Adjust	126414	c2b24	2		2D	Variable Valve Timing (AVCS)
Exhaust Duty Correction F Adjust	126420	c2b38	2		2D	Variable Valve Timing (AVCS)
Minimum Port Injection Quantity	10de34	10de34	1		2D	Fueling - Port Injectors
Fuel Injection Ratio ECT Threshold A	10de64	10de64	2		2D	Fueling - Injector Ratio
Low Pulse Width Fuel Injector Compensation	10f358		8		2D	Fueling - Port Injectors
Low Pulse Width Fuel Injector Compensation Maximum RPM	10e500		1		2D	Fueling - Port Injectors
Low Pulse Width Fuel Injector Compensation Maximum IPW	10e504		1		2D	Fueling - Port Injectors
Overrun Fueling RPM Resume Threshold	110e38		16		2D	Fueling - Overrun
Overrun Enrich RPM Delta Activation	10e530	10e530	1		2D	Fueling - Overrun
Overrun initial injector enrichment (pulsewidth)	10e534		1		2D	Fueling - Overrun
Overrun Fueling Cut Counter RPM Threshold	10e5c8	10e5c8	5		2D	Fueling - Overrun
Hotstart Enrichment Decay Delay	10dc26	10dc26	1		2D	Fueling - Hotstart Enrichment
Hotstart Enrichment Decay Step	10e364	10e364	1		2D	Fueling - Hotstart Enrichment
Initial Hotstart Enrichment (High)	10e350		1		2D	Fueling - Hotstart Enrichment
Hotstart High Enrichment Activation Threshold (Coolant Temperature)	10e340		1		2D	Fueling - Hotstart Enrichment
Hotstart High Enrichment Activation Threshold (Intake Air Temperature)	10e344		1		2D	Fueling - Hotstart Enrichment
Initial Hotstart Enrichment (Low)	10e354		1		2D	Fueling - Hotstart Enrichment
Hotstart Low Enrichment Activation Threshold (Coolant Temperature)	10e348		1		2D	Fueling - Hotstart Enrichment
Maximum Non-Idle Hotstart Enrichment (Post Delay)	10e368		1		2D	Fueling - Hotstart Enrichment
Hotstart Minimum Enrichment Limit Runtime	10dc28	10dc28	1		2D	Fueling - Hotstart Enrichment
Hotstart Minimum Enrichment (During Delay and Runtime)	10e360		1		2D	Fueling - Hotstart Enrichment
A/F #3 CL Target Compensation Limits	64700		2		2D	Fueling - AF Correction / Learning
A/F #3 Correction Limits	65084		2		2D	Fueling - AF Correction / Learning
Launch Control Disable Speed			1		2D	Launch Control/FFS
Launch Control RPM Delta			1		2D	Launch Control/FFS
Flat-Foot Shift RPM Delta			1		2D	Launch Control/FFS
CL Fueling Target Compensation (Load)			10	13	3D	Fueling - Closed Loop
CL Fueling Target Compensation (Load)(MT)			10	13	3D	Fueling - Closed Loop
CL Fueling Target Compensation (Load)(AT)			10	13	3D	Fueling - Closed Loop
CL Fueling Target Compensation C (Load)			11	11	3D	Fueling - Closed Loop
CL Fueling Target Compensation D (Load)			11	11	3D	Fueling - Closed Loop
CL Fueling Target Compensation Imm. Cruise (ECT)			3	16	3D	Fueling - Closed Loop
CL Fueling Target Compensation Imm. Non-Cruise (ECT)			3	16	3D	Fueling - Closed Loop
CL Fueling Target Compensation (ECT)			3	16	3D	Fueling - Closed Loop
CL Fueling Target Compensation A (ECT)(MT)			3	16	3D	Fueling - Closed Loop
CL Fueling Target Compensation A (ECT)(AT)			3	16	3D	Fueling - Closed Loop
CL Fueling Target Compensation B (ECT)(MT)			3	16	3D	Fueling - Closed Loop
CL Fueling Target Compensation B (ECT)(AT)			3	16	3D	Fueling - Closed Loop
CL Fueling Target Compensation (ECT) 			16		2D	Fueling - Closed Loop
CL to OL Delay			9		2D	Fueling - CL/OL Transition
CL to OL Delay 			1		2D	Fueling - CL/OL Transition
CL to OL Delay/Switch SI-DRIVE Intelligent			1		2D	Fueling - CL/OL Transition
CL to OL Delay (Atm. Pressure)			7		2D	Fueling - CL/OL Transition
CL to OL Delay A (Atm. Pressure)			7		2D	Fueling - CL/OL Transition
CL to OL Delay B (Atm. Pressure)			7		2D	Fueling - CL/OL Transition
CL to OL Transition with Delay (Throttle)			16		2D	Fueling - CL/OL Transition
CL to OL Transition with Delay (Accelerator)			16		2D	Fueling - CL/OL Transition
CL to OL Transition with Delay A (Throttle)			16		2D	Fueling - CL/OL Transition
CL to OL Transition with Delay B (Throttle)			16		2D	Fueling - CL/OL Transition
CL to OL Transition with Delay C (Throttle)			16		2D	Fueling - CL/OL Transition
CL to OL Transition with Delay Throttle Hysteresis			1		2D	Fueling - CL/OL Transition
CL to OL Transition with Delay A (Base Pulse Width)			16		2D	Fueling - CL/OL Transition
CL to OL Transition with Delay B (Base Pulse Width)			16		2D	Fueling - CL/OL Transition
CL to OL Transition with Delay C (Base Pulse Width)			16		2D	Fueling - CL/OL Transition
CL to OL Transition with Delay BPW Hysteresis			1		2D	Fueling - CL/OL Transition
CL to OL Transition Counter Step Value (MAF)			10		2D	Fueling - CL/OL Transition
CL Delay Period			3		2D	Fueling - CL/OL Transition
CL Delay Maximum (EGT)			2		2D	Fueling - CL/OL Transition
CL Delay Maximum (Throttle)			1		2D	Fueling - CL/OL Transition
CL Maximum Vehicle Speed			2		2D	Fueling - CL/OL Transition
CL Delay Minimum (ECT)			1		2D	Fueling - CL/OL Transition
CL Delay Maximum (Engine Load)			2		2D	Fueling - CL/OL Transition
CL Delay Engine Load Counter Threshold			1		2D	Fueling - CL/OL Transition
CL Delay Maximum Engine Speed (Per Gear)(MT)			10		2D	Fueling - CL/OL Transition
CL Delay Maximum Engine Speed (Per Gear)(AT)			10		2D	Fueling - CL/OL Transition
CL Delay Maximum Engine Speed (Neutral)			2		2D	Fueling - CL/OL Transition
CL Delay Maximum Engine Speed A			2		2D	Fueling - CL/OL Transition
CL Delay Maximum Engine Speed B			1		2D	Fueling - CL/OL Transition
CL Delay Engine Speed B Counter Threshold			1		2D	Fueling - CL/OL Transition
CL Delay Maximum (Throttle) A			1		2D	Fueling - CL/OL Transition
CL Delay Throttle A Counter Threshold			1		2D	Fueling - CL/OL Transition
CL Delay Maximum (Throttle) B (ECT)			16		2D	Fueling - CL/OL Transition
CL Delay Throttle Atm. Pressure Thresholds			2		2D	Fueling - CL/OL Transition
CL Delay Maximum (Throttle) (Low Atm. Pressure)			2		2D	Fueling - CL/OL Transition
CL Delay Maximum (Throttle) (High Atm. Pressure)			2		2D	Fueling - CL/OL Transition
Per Injector Primary Fuel Offset Compensation A			14	8	3D	Fueling - Port Injectors
Per Injector Primary Fuel Offset Compensation B			14	8	3D	Fueling - Port Injectors
Per Injector Primary Fuel Offset Compensation C			14	8	3D	Fueling - Port Injectors
Per Injector Primary Fuel Offset Compensation D			14	8	3D	Fueling - Port Injectors
Per Injector Primary Fuel Offset Compensation A 			7	8	3D	Fueling - Port Injectors
Per Injector Primary Fuel Offset Compensation B 			7	8	3D	Fueling - Port Injectors
Per Injector Primary Fuel Offset Compensation C 			7	8	3D	Fueling - Port Injectors
Per Injector Primary Fuel Offset Compensation D 			7	8	3D	Fueling - Port Injectors
Throttle Tip-in Enrichment			18		2D	Fueling - Tip-in Enrichment
Tip-in Enrichment Compensation (Boost Error)			9		2D	Fueling - Tip-in Enrichment
Tip-in Enrichment Compensation (ECT)			16		2D	Fueling - Tip-in Enrichment
Tip-in Enrichment Compensation D (ECT) 			16		2D	Fueling - Tip-in Enrichment
Tip-in Enrichment Compensation D (ECT) Activation 			1		2D	Fueling - Tip-in Enrichment
Tip-in Enrichment Disable Applied Counter Threshold			1		2D	Fueling - Tip-in Enrichment
Tip-in Enrichment Disable Throttle Cumulative Threshold			1		2D	Fueling - Tip-in Enrichment
A/F #3 Learning Limits			2		2D	Fueling - AF Correction / Learning
Cranking Fuel Injector Pulse Width A (ECT)			3	16	3D	Fueling - Cranking
Cranking Fuel Injector Pulse Width C (ECT)			2	16	3D	Fueling - Cranking
Cranking Fuel Injector Pulse Width D (ECT)			2	16	3D	Fueling - Cranking
Cranking Fuel Injector Pulse Width G (ECT)			2	16	3D	Fueling - Cranking
Cranking Fuel Injector Pulse Width H (ECT)			2	16	3D	Fueling - Cranking
Hotstart Low Enrichment Activation Threshold (Intake Air Temperature)			1		2D	Fueling - Hotstart Enrichment
Hotstart Maximum Non-Idle Enrichment Delay			1		2D	Fueling - Hotstart Enrichment
Base Timing			18	15	3D	Ignition Timing - Advance
Base Timing C			18	15	3D	Ignition Timing - Advance
Base Timing D			18	15	3D	Ignition Timing - Advance
Base Timing E			18	15	3D	Ignition Timing - Advance
Base Timing F			18	15	3D	Ignition Timing - Advance
Base Timing G			18	15	3D	Ignition Timing - Advance
Base Timing H			18	15	3D	Ignition Timing - Advance
Base Timing Primary Cruise			18	15	3D	Ignition Timing - Advance
Base Timing Reference Cruise (AVCS related)			18	15	3D	Ignition Timing - Advance
Base Timing Primary Non-Cruise			18	15	3D	Ignition Timing - Advance
Base Timing Reference Non-Cruise (AVCS related)			18	15	3D	Ignition Timing - Advance
Base Timing Idle			16		2D	Ignition Timing - Advance
Base Timing Idle A (In-Gear)			16		2D	Ignition Timing - Advance
Base Timing Idle B (In-Gear)			16		2D	Ignition Timing - Advance
Base Timing Idle A (Neutral)			16		2D	Ignition Timing - Advance
Base Timing Idle B (Neutral)			16		2D	Ignition Timing - Advance
Base Timing Idle (Below Speed Threshold)			1		2D	Ignition Timing - Advance
Base Timing Idle (Below Speed Threshold) 			9		2D	Ignition Timing - Advance
Base Timing Idle (Above Speed Threshold)			9		2D	Ignition Timing - Advance
Base Timing Idle (In-Gear)(Above Speed Threshold) 2D			9		2D	Ignition Timing - Advance
Base Timing Idle A (In-Gear)(Above Speed Threshold)			9		2D	Ignition Timing - Advance
Base Timing Idle A (In-Gear)(Above Speed Threshold)(MT)			9		2D	Ignition Timing - Advance
Base Timing Idle A (In-Gear)(Above Speed Threshold)(AT)			9		2D	Ignition Timing - Advance
Base Timing Idle B (In-Gear)(Above Speed Threshold)			9		2D	Ignition Timing - Advance
Base Timing Idle B (In-Gear)(Above Speed Threshold) 			4	10	3D	Ignition Timing - Advance
Base Timing Idle B (In-Gear)(Above Speed Threshold)(MT)			9		2D	Ignition Timing - Advance
Base Timing Idle B (In-Gear)(Above Speed Threshold)(MT) 			4	10	3D	Ignition Timing - Advance
Base Timing Idle B (In-Gear)(Above Speed Threshold)(AT)			9		2D	Ignition Timing - Advance
Base Timing Idle A (In-Gear)(Below Speed Threshold)			9		2D	Ignition Timing - Advance
Base Timing Idle A (In-Gear)(Below Speed Threshold)(MT)			9		2D	Ignition Timing - Advance
Base Timing Idle A (In-Gear)(Below Speed Threshold)(AT)			9		2D	Ignition Timing - Advance
Base Timing Idle B (In-Gear)(Below Speed Threshold)			9		2D	Ignition Timing - Advance
Base Timing Idle B (In-Gear)(Below Speed Threshold)(MT)			9		2D	Ignition Timing - Advance
Base Timing Idle B (In-Gear)(Below Speed Threshold)(AT)			9		2D	Ignition Timing - Advance
Base Timing Idle A (Neutral) 			9		2D	Ignition Timing - Advance
Base Timing Idle A (Neutral)(MT)			9		2D	Ignition Timing - Advance
Base Timing Idle A (Neutral)(AT)			9		2D	Ignition Timing - Advance
Base Timing Idle B (Neutral) 			9		2D	Ignition Timing - Advance
Base Timing Idle B (Neutral)(MT)			9		2D	Ignition Timing - Advance
Base Timing Idle B (Neutral)(AT)			9		2D	Ignition Timing - Advance
Base Timing Idle Minimum			9		2D	Ignition Timing - Advance
Base Timing Idle Minimum Vehicle Speed Enable			1		2D	Ignition Timing - Advance
Base Timing Alternate (ECT)			16		2D	Ignition Timing - Advance
Knock Correction Advance Max			18	16	3D	Ignition Timing - Advance
Knock Correction Advance Max B			18	16	3D	Ignition Timing - Advance
Knock Correction Advance Max Additive (Knock Conditions)			18	16	3D	Ignition Timing - Advance
Knock Correction Advance Max Additive A (Knock Conditions)(IAM)			18	16	3D	Ignition Timing - Advance
Knock Correction Advance Max Additive B (Knock Conditions)			18	16	3D	Ignition Timing - Advance
Knock Correction Advance Max Primary (Knock Conditions High)(IAM)			18	16	3D	Ignition Timing - Advance
Knock Correction Advance Max Primary (Knock Conditions Low)(IAM)			18	16	3D	Ignition Timing - Advance
Knock Correction Advance Max Primary Cruise (IAM)			18	16	3D	Ignition Timing - Advance
Knock Correction Advance Max Cruise			18	16	3D	Ignition Timing - Advance
Knock Correction Advance Max Primary Non-Cruise (IAM)			18	16	3D	Ignition Timing - Advance
Knock Correction Advance Max Non-Cruise			18	16	3D	Ignition Timing - Advance
Knock Correction Advance Alternate Mode			1		Switch	Ignition Timing - Advance
Knock Correction Advance Alternate Mode 			1		Switch	Ignition Timing - Advance
Knock Correction Advance Alternate Mode  			1		Switch	Ignition Timing - Advance
Knock Correction Advance Additive Range (RPM)			4		2D	Ignition Timing - Advance
Timing Compensation A (IAT)			16		2D	Ignition Timing - Compensation
Timing Compensation (IAT) Activation 			8	8	3D	Ignition Timing - Compensation
Timing Compensation A (IAT) Activation			8	8	3D	Ignition Timing - Compensation
Timing Comp Min Load (IAT)			1		2D	Ignition Timing - Compensation
Timing Compensation B (IAT)			16		2D	Ignition Timing - Compensation
Timing Compensation B (IAT) IAM Activation			1		2D	Ignition Timing - Compensation
Timing Compensation B (IAT) Max Additive			1		2D	Ignition Timing - Compensation
Timing Compensation (ECT)			16		2D	Ignition Timing - Compensation
Timing Compensation C (ECT)			16		2D	Ignition Timing - Compensation
Timing Compensation D (ECT)			16		2D	Ignition Timing - Compensation
Timing Compensation Imm. Cruise A (ECT)			16		2D	Ignition Timing - Compensation
Timing Compensation Imm. Cruise B (ECT)			16		2D	Ignition Timing - Compensation
Timing Compensation Imm. Non-Cruise A (ECT)			16		2D	Ignition Timing - Compensation
Timing Compensation Imm. Non-Cruise B (ECT)			16		2D	Ignition Timing - Compensation
Timing Compensation (MRP)			3	5	3D	Ignition Timing - Compensation
Timing Compensation Per Cylinder A  			14		2D	Ignition Timing - Compensation
Timing Compensation Per Cylinder B  			14		2D	Ignition Timing - Compensation
Timing Compensation Per Cylinder C  			14		2D	Ignition Timing - Compensation
Timing Compensation Per Cylinder D  			14		2D	Ignition Timing - Compensation
Timing Compensation Per Cylinder A 			16		2D	Ignition Timing - Compensation
Timing Compensation Per Cylinder B 			16		2D	Ignition Timing - Compensation
Timing Compensation Per Cylinder C 			16		2D	Ignition Timing - Compensation
Timing Compensation Per Cylinder D 			16		2D	Ignition Timing - Compensation
Timing Compensation Per Cylinder E			4	14	3D	Ignition Timing - Compensation
Timing Compensation Per Cylinder F			4	14	3D	Ignition Timing - Compensation
Timing Compensation Per Gear (1st)			3	4	3D	Ignition Timing - Compensation
Timing Compensation Per Gear (2nd)			3	4	3D	Ignition Timing - Compensation
Timing Compensation Per Gear (3rd)			3	4	3D	Ignition Timing - Compensation
Timing Compensation Per Gear (4th)			3	4	3D	Ignition Timing - Compensation
Timing Compensation Per Gear (5th)			3	4	3D	Ignition Timing - Compensation
Timing Compensation Per Gear Activation (RPM)			2		2D	Ignition Timing - Compensation
Timing Compensation Per Gear Activation (Load)			2		2D	Ignition Timing - Compensation
Feedback Correction Minimum Load 			4		2D	Ignition Timing - Knock Control
Feedback Correction Retard Value 			13		2D	Ignition Timing - Knock Control
Feedback Correction Negative Advance Delay 			13		2D	Ignition Timing - Knock Control
Extended Feedback Correction High RPM Compensation			1		2D	Ignition Timing - Knock Control
Fine Correction Minimum (RPM)			2		2D	Ignition Timing - Knock Control
Fine Correction Maximum (RPM)			2		2D	Ignition Timing - Knock Control
Fine Correction Rows (RPM) 			7		2D	Ignition Timing - Knock Control
Fine Correction Columns (Load) 			7		2D	Ignition Timing - Knock Control
Fine Correction Retard Value A			1		2D	Ignition Timing - Knock Control
Fine Correction Retard Value B			1		2D	Ignition Timing - Knock Control
Fine Correction Retard Value 			13		2D	Ignition Timing - Knock Control
Rough Correction Learning Delay (Increasing)			10		2D	Ignition Timing - Knock Control
Rough Correction Learning Delay (Increasing) 			10		2D	Ignition Timing - Knock Control
Target Throttle Plate Position Divider (RPM)			23		2D	Drive-by-Wire Throttle (DBW)
5V Sensor Scaling 4 Multiplier			1		2D	5V Sensor
5V Sensor Scaling 4 Offset			1		2D	5V Sensor
5V Sensor Scaling 9 Multiplier			1		2D	5V Sensor
5V Sensor Scaling 9 Offset			1		2D	5V Sensor
Speed Limiting (Throttle) 			4		2D	Miscellaneous - Limits
Speed Limiting (Fuel Cut)			4		2D	Miscellaneous - Limits
Speed Limiting (Throttle)			2		2D	Miscellaneous - Limits
Speed Limiting A (Throttle)			2		2D	Miscellaneous - Limits
Speed Limiting B (Throttle)			2		2D	Miscellaneous - Limits
Speed Limiting (Throttle) SI-DRIVE Intelligent			2		2D	Miscellaneous - Limits
EGT Sensor Scaling			30		2D	Miscellaneous - Sensor Scalings
Fuel Temp Sensor Scaling			30		2D	Miscellaneous - Sensor Scalings
Atmospheric Pressure Sensor Scaling			2		2D	Miscellaneous - Sensor Scalings
Fuel Pump Duty Cycle			2		2D	Miscellaneous - Thresholds
Radiator Fan Modes (ECT)			4		2D	Miscellaneous - Thresholds
Radiator Fan Modes C (ECT)			4		2D	Miscellaneous - Thresholds
Radiator Fan Modes D (ECT)			4		2D	Miscellaneous - Thresholds
Atmospheric Pressure Sensor Scaling 			2		2D	Miscellaneous - Sensor Scalings
Gear Determination Thresholds			5		2D	Miscellaneous - Thresholds
Gear Determination Thresholds C			5		2D	Miscellaneous - Thresholds
OL Fuelling Throttle Compensation			6		2D	Alpha - BRZ
OL Fuelling Accelerator Compensation			6		2D	Alpha - BRZ
Catalyst Warm Up Idle			3	16	3D	Ignition Timing - Compensation
Catalyst Warm Up Non-Idle			3	16	3D	Ignition Timing - Compensation
AFR Sensor Heating Limit A			6	6	3D	Fueling - O2 Sensor #1
AFR Sensor Heating Limit B			6	6	3D	Fueling - O2 Sensor #1
Fuel Injection Ratio ECT Threshold B		10de74	2		2D	Fueling - Injector Ratio
